id,date,period,subject,title,place,place_en,genre,institution
D114101083,2014-10-12,NA:2014-10-31:NA,九州国立博物館アソシエイトフェロー（文化財防災ネットワーク推進事業）の公募,アソシエイトフェロー:研究員・ポスドク相当,"[""福岡県""]","[""Fukuoka""]",複合領域,独立行政法人国立文化財機構
D114101009,2014-10-11,2014-10-10:2014-12-10:NA,教授公募（東工大地球惑星）,教授相当,"[""東京都""]","[""Tokyo""]",数物系科学,東京工業大学
D114101095,2014-10-11,2014-10-10:2014-10-31:NA,FD支援担当嘱託講師募集,准教授・常勤専任講師相当,"[""滋賀県 京都府 大阪府""]",[nil],その他,立命館大学
D114101054,2014-10-11,NA:2014-11-17:NA,教授公募　大学院医学系研究科保健学専攻　医療技術科学分野機能診断科学講座,教授相当,"[""大阪府""]","[""Osaka""]",医歯薬学,大阪大学
D114101055,2014-10-11,NA:2014-12-05:NA,医学研究院保健学部門看護学分野統合基礎看護学領域（成人・老年看護学担当）助教候補者の募集について（依頼）,助教相当,"[""福岡県""]","[""Fukuoka""]",医歯薬学,九州大学
D114101057,2014-10-11,NA:2014-12-05:NA,医学研究院保健学部門看護学分野広域生涯看護学領域（公衆衛生看護学・在宅看護学担当）助教候補者の募集について（依頼）,助教相当,"[""福岡県""]","[""Fukuoka""]",医歯薬学,九州大学
D114101058,2014-10-11,NA:2014-12-31:NA,ポスドク募集（心臓再生医療分野）,研究員・ポスドク相当,"[""岡山県""]","[""Okayama""]",医歯薬学:生物学:生物学,岡山大学
D114101079,2014-10-11,2014-10-11:2014-10-25:NA,医学研究科細胞薬理学分野・助教募集,助教相当,"[""北海道""]","[""Hokkaido""]",医歯薬学,北海道大学
D114101081,2014-10-11,NA:2015-10-11:NA,研究員、特別研究員、リサーチアソシエイト、技師、テクニカルスタッフ募集 (MNCIU1401) （分子ネットワーク制御イメージングユニット）,研究員・ポスドク相当:研究・教育補助者相当,"[""兵庫県""]","[""Hyōgo""]",生物学:生物学:医歯薬学,独立行政法人理化学研究所
D114101085,2014-10-11,2014-10-11:2014-11-15:募集人数が少ない場合は延長する可能性あり,生殖補助医療胚培養士（嘱託職員）,研究・教育補助者相当,"[""兵庫県""]","[""Hyōgo""]",医歯薬学:医歯薬学,兵庫医科大学
D114101029,2014-10-11,NA:2014-11-10:NA,技術補佐員募集（細菌感染生物学 社会連携研究部門）,研究・教育補助者相当,"[""東京都""]","[""Tokyo""]",医歯薬学:生物学,東京大学
D114101101,2014-10-11,NA:2014-10-24:NA,卒後臨床研修センター教授候補者の推薦,教授相当,"[""島根県""]","[""Shimane""]",医歯薬学,島根大学
D114101104,2014-10-11,NA:2014-12-09:NA,京都大学大学院医学研究科心臓血管外科学　教授の公募,教授相当,"[""京都府""]","[""Kyoto""]",医歯薬学,京都大学
D114101112,2014-10-11,2014-10-12:2015-03-31:適任者が決まり次第、募集を締め切る可能性があります。,技術補佐員、教務補佐員（時間雇用職員）の公募（薬剤疫学分野）,研究・教育補助者相当,"[""京都府""]","[""Kyoto""]",医歯薬学:医歯薬学,京都大学
D114101108,2014-10-11,2014-10-09:2014-11-25:NA,整形外科学講座 教授候補者の公募,教授相当,"[""滋賀県""]","[""Shiga""]",医歯薬学,滋賀医科大学
D114101113,2014-10-11,NA:2014-10-31:NA,教務補佐員の公募（遺伝子実験施設）,研究・教育補助者相当,"[""山口県""]","[""Yamaguchi""]",生物学:医歯薬学,山口大学
D114101115,2014-10-11,NA:2014-11-30:NA,モデル動物開発研究部 テクニカルスタッフ（非常勤職員）の公募について,研究・教育補助者相当,"[""東京都""]","[""Tokyo""]",生物学:医歯薬学,独立行政法人国立精神・神経医療研究センター
D114101126,2014-10-11,NA:2014-11-30:適切な人材が集まり次第、募集は締め切らせて頂きます。,神経研究所　疾病研究第五部　流動研究員（非常勤職員）の募集について,研究員・ポスドク相当,"[""東京都""]","[""Tokyo""]",医歯薬学:生物学,独立行政法人国立精神・神経医療研究センター
D114101116,2014-10-11,NA:2014-11-10:NA,目白大学看護学部看護学科　准教授または専任講師（成人看護学）募集のお知らせ,准教授・常勤専任講師相当,"[""埼玉県""]","[""Saitama""]",医歯薬学,目白大学
D114101036,2014-10-11,2014-10-10:2014-10-31:NA,定年制職員(主任研究員)の公募について(放射線防護研究センター),准教授・常勤専任講師相当,"[""千葉県""]","[""Chiba""]",総合生物:医歯薬学:環境学,独立行政法人放射線医学総合研究所
D114101038,2014-10-11,NA:2014-10-31:NA,生物薬品部研究員（薬学系）の公募について,研究員・ポスドク相当,"[""東京都""]","[""Tokyo""]",医歯薬学,国立医薬品食品衛生研究所
D114101127,2014-10-11,NA:2014-11-17:NA,健康科学部看護学科（成人看護学分野、急性期看護あるいは慢性期看護、がん看護学）の教授または准教授の募集,教授相当:准教授・常勤専任講師相当,"[""新潟県""]","[""Niigata""]",医歯薬学,新潟医療福祉大学
D114101045,2014-10-11,NA:2014-12-01:NA,"Danish Research Institute of Translational Neuroscience (DANDRITE), Nordic EMBL Partnership for Molecular Medicine, Aarhus University 米原研究室　ポスドク募集　神経科学分野",研究員・ポスドク相当,"[""その他""]",[nil],総合生物:生物学:医歯薬学,オーフス大学
D114101131,2014-10-11,NA:2014-10-31:NA,ポスドク募集（癌の基礎研究）,研究員・ポスドク相当,"[""神奈川県""]","[""Kanagawa""]",生物学:医歯薬学,日本医科大学
D114101021,2014-10-11,NA:2014-11-14:NA,看護学講座（精神看護学領域）教授候補者の公募について,教授相当,"[""北海道""]","[""Hokkaido""]",医歯薬学,旭川医科大学
D114101013,2014-10-11,2014-10-09:2014-10-24:NA,放射線医学講座 准教授候補者の公募,准教授・常勤専任講師相当,"[""滋賀県""]","[""Shiga""]",医歯薬学,滋賀医科大学
D114101088,2014-10-11,NA:2015-01-31:NA,ワクチン開発プロジェクト研究員　募集のお知らせ,研究員・ポスドク相当:研究開発・技術者相当,"[""大阪府""]","[""Osaka""]",生物学:医歯薬学,第一三共株式会社
D114101014,2014-10-11,NA:2014-11-10:NA,教授又は准教授（特定任期付）の公募（医学部附属病院放射線診療科群（放射線治療科））,教授相当:准教授・常勤専任講師相当,"[""鳥取県""]","[""Tottori""]",医歯薬学,鳥取大学
D114101066,2014-10-11,NA:2014-11-20:NA,教員の公募について（文学部門　中国文学講座）,教授相当,"[""福岡県""]","[""Fukuoka""]",人文学,九州大学
D114101130,2014-10-11,2014-10-11:2014-10-31:NA,特別研究員募集(新しい産業を生む、カーボンナノチューブによる、革新的な用途および機能性複合材料開発),研究員・ポスドク相当,"[""茨城県""]","[""Ibaraki""]",工学:化学:総合理工,独立行政法人産業技術総合研究所
D114101128,2014-10-11,2014-10-11:2014-10-31:NA,特別研究員募集(新しい産業を生む、カーボンナノチューブの革新的合成技術開発),研究員・ポスドク相当,"[""茨城県""]","[""Ibaraki""]",工学:化学:工学,独立行政法人産業技術総合研究所
D114101097,2014-10-11,NA:2014-10-26:但し決まり次第締めきる,研究業務員 (任期制)募集（界面機能グループ）,研究・教育補助者相当,"[""茨城県""]","[""Ibaraki""]",化学:総合理工,独立行政法人物質・材料研究機構
D114101119,2014-10-11,NA:2015-03-31:採用者が決定した時点で募集を締め切ります,技術補佐員の募集（阪大・蛋白研・超分子）,研究・教育補助者相当,"[""大阪府""]","[""Osaka""]",生物学:化学,大阪大学
D114101110,2014-10-11,2014-10-11:2014-10-20:NA,パートタイム募集,研究・教育補助者相当,"[""愛知県""]","[""Aichi""]",工学:化学,名古屋工業大学
D114101092,2014-10-11,NA:2015-01-11:NA,テクニカルスタッフ募集（フレキシブル化学コーティング研究グループ：14-2-38）,研究・教育補助者相当,"[""茨城県""]","[""Ibaraki""]",化学,独立行政法人産業技術総合研究所
D114101048,2014-10-11,2014-10-10:2014-11-07:但し、募集期間内であっても、適任者が見つかり次第終了する。,鹿児島大学大学院理工学研究科生命化学専攻プロジェクト研究員募集,研究員・ポスドク相当,"[""鹿児島県""]","[""Kagoshima""]",化学:化学,鹿児島大学
D114101089,2014-10-11,NA:2014-10-31:NA,テクニカルスタッフ募集（フレキシブル化学コーティング研究グループ：14-2-39）,研究・教育補助者相当,"[""茨城県""]","[""Ibaraki""]",化学,独立行政法人産業技術総合研究所
D114101053,2014-10-11,2014-10-09:2015-03-31:但し、応募期限前でも応募書類は適宜選考し、 採用者を決定次第、締め切ります。,さきがけ研究技術補佐員の募集（名古屋大学トランスフォーマティブ生命分子研究所Kay-廣田グループ）,研究・教育補助者相当,"[""愛知県""]","[""Aichi""]",生物学:医歯薬学:化学,名古屋大学
D114101070,2014-10-11,NA:2015-10-11:NA,特別研究員またはテクニカルスタッフ募集（創薬シード化合物探索基盤ユニット）,研究員・ポスドク相当:研究・教育補助者相当,"[""埼玉県""]","[""Saitama""]",化学:生物学:医歯薬学,独立行政法人理化学研究所
D114100918,2014-10-11,NA:2015-10-11:適任者が決まり次第締め切ります。,テクニカルスタッフ募集（袖岡有機合成化学研究室①）,研究・教育補助者相当,"[""埼玉県""]","[""Saitama""]",化学:総合生物:生物学,独立行政法人理化学研究所
D114100923,2014-10-11,NA:2015-10-11:適任者が決まり次第締め切ります。,テクニカルスタッフ募集（袖岡有機合成化学研究室②）,研究・教育補助者相当,"[""埼玉県""]","[""Saitama""]",総合生物:化学:生物学,独立行政法人理化学研究所
D114100910,2014-10-11,NA:2015-10-11:随時選考し、適任者が決定次第、締め切ります。,テクニカルスタッフ・特別研究員募集（触媒・融合研究グループ）,研究員・ポスドク相当:研究・教育補助者相当,"[""埼玉県""]","[""Saitama""]",化学:生物学:環境学,独立行政法人理化学研究所
D114100984,2014-10-11,NA:2015-10-11:NA,特別研究員・研究員・テクニカルスタッフ募集（光量子制御技術開発チーム）,研究員・ポスドク相当:研究・教育補助者相当,"[""埼玉県""]","[""Saitama""]",総合理工,独立行政法人理化学研究所
D114101075,2014-10-11,NA:2015-01-11:適任者が見つかり次第終了。,研究業務員 (任期制)募集（MANA独立研究者、吉川グループ）,研究・教育補助者相当,"[""茨城県""]","[""Ibaraki""]",総合理工,独立行政法人物質・材料研究機構
D114101063,2014-10-11,NA:2015-01-11:NA,研究業務員 (任期制)募集（原子間力プローブ計測グループ）,研究・教育補助者相当,"[""茨城県""]","[""Ibaraki""]",総合理工,独立行政法人物質・材料研究機構
D114101078,2014-10-11,NA:2014-10-24:NA,テクニカルスタッフ募集（細胞増殖制御研究グループ：2014CPR-5）,研究・教育補助者相当,"[""茨城県""]","[""Ibaraki""]",総合生物,独立行政法人産業技術総合研究所
D114101062,2014-10-11,NA:2014-11-21:１７時【必着】,産総研特別研究員募集（情報数理研究グループ：HTRI　Ｈ２６Ｌ－１－１）,研究員・ポスドク相当,"[""茨城県""]","[""Ibaraki""]",複合領域:総合生物,独立行政法人産業技術総合研究所
D114101035,2014-10-11,2014年11月03日 消印有効,留学・留学生担当専任講師募集,准教授・常勤専任講師相当,"[""東京都""]","[""Tokyo""]",人文学:社会科学:その他,東京大学
D114101043,2014-10-11,NA:2014-12-19:NA,臨床栄養学教員（教授または准教授）の公募,教授相当:准教授・常勤専任講師相当,"[""高知県""]","[""Kochi""]",複合領域,高知県立大学
D114101046,2014-10-11,2014-10-10:2014-11-04:NA,プロダクトデザイン学科　非常勤講師の公募,非常勤講師相当,"[""兵庫県""]","[""Hyōgo""]",複合領域,神戸芸術工科大学
D114101052,2014-10-11,NA:2014-12-10:NA,昭和女子大学　非常勤講師の公募（アパレルCG&プレゼンテーションの分野）,非常勤講師相当,"[""東京都""]","[""Tokyo""]",複合領域,昭和女子大学
D114101129,2014-10-11,2014-10-10:2014-11-25:NA,実験実習助手（有期）,研究・教育補助者相当,"[""神奈川県""]","[""Kanagawa""]",複合領域,相模女子大学
D114101032,2014-10-11,NA:2014-11-11:NA,教授の公募（基礎看護学）,教授相当,"[""京都府""]","[""Kyoto""]",医歯薬学,京都府立医科大学
D114101117,2014-10-11,NA:2014-11-07:NA,特任講師の公募(国際協力論・NPO組織論）,准教授・常勤専任講師相当,"[""東京都""]","[""Tokyo""]",社会科学,お茶の水女子大学
D114100982,2014-10-11,NA:2014-11-11:NA,文学部人文学科専任教員の公募,教授相当:准教授・常勤専任講師相当,"[""埼玉県 東京都""]",[nil],総合人文社会:社会科学,跡見学園女子大学
D114101111,2014-10-11,NA:2014-11-28:NA,帝京大学経済学部経営学科　専任教員（経営組織論）の公募について,教授相当:准教授・常勤専任講師相当:助教相当,"[""東京都""]","[""Tokyo""]",社会科学:社会科学,帝京大学
D114101098,2014-10-11,NA:2014-11-10:NA,九州産業大学経済学部　経済学科（行政法・憲法）専任教員【教授、准教授、講師】の公募について,教授相当:准教授・常勤専任講師相当,"[""福岡県""]","[""Fukuoka""]",社会科学,九州産業大学
D114101094,2014-10-11,2014-10-11:2014-11-07:NA,児童教育学科専任教員〔幼児教育・保育〕の公募について,教授相当:准教授・常勤専任講師相当,"[""京都府""]","[""Kyoto""]",社会科学:複合領域,京都聖母女学院短期大学
D114101086,2014-10-11,2014年11月22日 消印有効,教授または准教授または講師（教育学分野）,教授相当:准教授・常勤専任講師相当,"[""愛知県""]","[""Aichi""]",社会科学,愛知学院大学
D114101049,2014-10-11,2014-10-11:2014-11-28:NA,介護福祉学科　専任教員の公募,教授相当:准教授・常勤専任講師相当:助教相当,"[""長野県""]","[""Nagano""]",社会科学,松本短期大学
D114101018,2014-10-11,2014-10-10:2014-10-20:NA,契約職員（契約研究員）の募集　【女性支援】,研究員・ポスドク相当,"[""茨城県""]","[""Ibaraki""]",農学:生物学,独立行政法人農業環境技術研究所
D114101077,2014-10-11,NA:2015-10-11:NA,テクニカルスタッフ募集（植物共生研究チーム）,研究・教育補助者相当,"[""神奈川県""]","[""Kanagawa""]",生物学:農学,独立行政法人理化学研究所
D114101076,2014-10-11,NA:2015-10-11:NA,研究員募集（植物共生研究チーム）,研究員・ポスドク相当,"[""神奈川県""]","[""Kanagawa""]",生物学:生物学:生物学,独立行政法人理化学研究所
D114101056,2014-10-11,2014-10-09:2014-11-28:NA,九州大学大学院理学研究院 生物科学部門 准教授募集（女性教員）,准教授・常勤専任講師相当,"[""福岡県""]","[""Fukuoka""]",生物学,九州大学
D114101064,2014-10-11,NA:2015-10-11:NA,パートタイマー募集（高次脳機能分子解析チーム：山森哲雄）,研究・教育補助者相当,"[""埼玉県""]","[""Saitama""]",生物学:生物学,独立行政法人理化学研究所
D114101040,2014-10-11,NA:2015-10-11:NA,パートタイマー募集（機能開発研究グループ）,研究・教育補助者相当,"[""神奈川県""]","[""Kanagawa""]",生物学:生物学,独立行政法人理化学研究所
D114100981,2014-10-11,2014-10-07:2014-11-04:NA,教授または准教授の公募（書道分野）,教授相当:准教授・常勤専任講師相当,"[""東京都""]","[""Tokyo""]",社会科学:その他,東京学芸大学
D114101071,2014-10-11,NA:2014-11-14:NA,協力研究員募集（実験装置運転・維持管理室）,研究員・ポスドク相当,"[""埼玉県""]","[""Saitama""]",総合理工:数物系科学,独立行政法人理化学研究所
D114101050,2014-10-11,NA:2014-12-22:NA,久留米工業高等専門学校 一般科目（理科系）教員公募（数学：助教または准教授）,助教相当:准教授・常勤専任講師相当,"[""福岡県""]","[""Fukuoka""]",数物系科学,久留米工業高等専門学校
D114100921,2014-10-11,NA:2015-10-11:適任者が見つかり次第締め切り。,特別研究員等募集（望月理論生物学研究室）,研究員・ポスドク相当,"[""埼玉県""]","[""Saitama""]",数物系科学:数物系科学,独立行政法人理化学研究所
D114101073,2014-10-11,2014-10-11:2014-12-08:NA,アニマルサイエンス学科専任教員公募,教授相当:准教授・常勤専任講師相当:助教相当,"[""山梨県""]","[""Yamanashi""]",農学:農学,帝京科学大学
D114100945,2014-10-11,NA:2014-12-01:NA,研究員（生物影響研究部（病理系））の募集,研究員・ポスドク相当,"[""青森県""]","[""Aomori""]",農学,公益財団法人環境科学技術研究所
D114101123,2014-10-11,NA:2014-11-21:NA,非常勤講師公募「中国文学(中国語学科専門講義科目)、中国語（本学横浜キャンパス全学部の外国語科目）」,非常勤講師相当,"[""神奈川県""]","[""Kanagawa""]",人文学:人文学,神奈川大学
D114100924,2014-10-11,2014-10-09:2014-11-14:NA,順天堂大学医学部一般教育（外国語）教員の募集,准教授・常勤専任講師相当:助教相当:研究・教育補助者相当,"[""千葉県""]","[""Chiba""]",人文学,順天堂大学
D114101068,2014-10-11,NA:2014-11-14:NA,薬学部 任期制講師の公募（英語教育分野）,准教授・常勤専任講師相当,"[""滋賀県""]","[""Shiga""]",人文学,立命館大学
D114101067,2014-10-11,NA:2014-11-30:NA,保育科専任教員、教授、准教授、講師の公募（音楽分野）,教授相当:准教授・常勤専任講師相当,"[""岐阜県""]","[""Gifu""]",社会科学:人文学,中京学院大学中京短期大学部
D114101069,2014-10-11,NA:2015-01-11:適任者が見つかり次第終了。,ポスドク研究員 (任期制)募集（MANA独立研究者　吉川グループ）,研究員・ポスドク相当,"[""茨城県""]","[""Ibaraki""]",総合理工:工学,独立行政法人物質・材料研究機構
D114101103,2014-10-11,NA:2014-10-30:適任者が見つかり次第、応募を締め切る可能性あり,プラザ・コーディネーター （任期制研究職）募集（構造材料つくばオープンプラザ（TOPAS））,研究管理者相当,"[""茨城県""]","[""Ibaraki""]",工学,独立行政法人物質・材料研究機構
D114101121,2014-10-11,NA:2014-11-21:NA,准教授、講師または助教の公募（給排水衛生設備分野）,准教授・常勤専任講師相当:助教相当,"[""福岡県""]","[""Fukuoka""]",工学:工学:工学,久留米工業大学
D114101114,2014-10-11,2014-10-15:2014-11-15:NA,工学部第二部建築学科、嘱託助教（設計系）の公募,助教相当,"[""東京都""]","[""Tokyo""]",工学,東京理科大学
D114101105,2014-10-11,NA:2015-01-11:採用者決定次第,テクニカルスタッフ募集（フレキシブル化学コーティング研究グループ：14-2-37）,研究・教育補助者相当,"[""茨城県""]","[""Ibaraki""]",工学:工学,独立行政法人産業技術総合研究所
D114101072,2014-10-11,NA:2014-12-19:NA,石川工業高等専門学校機械工学科教員公募,助教相当,"[""石川県""]","[""Ishikawa""]",工学,石川工業高等専門学校
D114101028,2014-10-11,NA:2014-11-04:NA,減災実験研究領域兵庫耐震工学研究センター　契約研究員（研究員型）,研究員・ポスドク相当,"[""兵庫県""]","[""Hyōgo""]",工学:工学:情報学,独立行政法人防災科学技術研究所
D114101022,2014-10-11,2014-10-10:2014-11-15:NA,教授または准教授の公募(航空工学科),教授相当:准教授・常勤専任講師相当,"[""鹿児島県""]","[""Kagoshima""]",工学,第一工業大学
D114100989,2014-10-11,NA:2014-11-15:NA,研究員、特別研究員募集（可視化技術研究チーム）,研究員・ポスドク相当,"[""兵庫県""]","[""Hyōgo""]",情報学,独立行政法人理化学研究所
D114101065,2014-10-11,NA:2015-10-11:NA,データ解析補助パートタイマー募集（理研BSI-トヨタ連携センター 認知行動科学連携ユニット）,研究・教育補助者相当,"[""埼玉県""]","[""Saitama""]",情報学:社会科学,独立行政法人理化学研究所
D114101107,2014-10-11,NA:2014-10-24:NA,医療情報部准教授候補者の推薦,准教授・常勤専任講師相当,"[""島根県""]","[""Shimane""]",情報学,島根大学
D114101060,2014-10-11,NA:2014-11-25:NA,教員の公募について（社会起業家論）,准教授・常勤専任講師相当,"[""香川県""]","[""Kagawa""]",社会科学:人文学:総合人文社会,香川大学
D114101042,2014-10-11,2014-10-10:2014-12-12:NA,先進治療科学専攻生体機能制御学講座口腔生理学分野 担当教授候補者の募集,教授相当,"[""鹿児島県""]","[""Kagoshima""]",医歯薬学,鹿児島大学
D114100953,2014-10-10,2014-10-10:2014-11-14:（但し，採用が確定次第，この期日よりも前に募集を終了します）,CREST研究員募集（筑波大学・情報学分野）,研究員・ポスドク相当,"[""茨城県""]","[""Ibaraki""]",情報学:情報学:複合領域,筑波大学
D114101006,2014-10-10,NA:2014-10-16:NA,任期制契約職員（主任調査員）の募集（産学基礎基盤推進部）,主任調査員,"[""東京都""]","[""Tokyo""]",複合領域,独立行政法人科学技術振興機構
D114100847,2014-10-10,NA:2014-11-30:NA,兼任講師（非常勤講師）の公募（健康科学）,非常勤講師相当,"[""大阪府""]","[""Osaka""]",複合領域,大阪物療大学
D114100950,2014-10-10,"2014年10月09日 ～,2014年10月31日 消印有効",教授または准教授の公募（管理栄養士養成課程・公衆栄養分野）,教授相当:准教授・常勤専任講師相当,"[""愛知県""]","[""Aichi""]",複合領域,修文大学
D114100951,2014-10-10,"2014年10月09日 ～,2014年10月31日 消印有効",健康栄養学部応用栄養学担当の教授または准教授,教授相当:准教授・常勤専任講師相当,"[""愛知県""]","[""Aichi""]",複合領域,修文大学
D114100940,2014-10-10,2014-10-09:2014-11-08:採用が決まり次第公募終了,スクールカウンセラー（非常勤）の公募,専門学校・小中高等の教員相当,"[""宮城県""]","[""Miyagi""]",社会科学:その他,仙台医療秘書福祉専門学校
D114100672,2014-10-10,"2014年10月06日 ～,2014年10月18日 消印有効",健康栄養学部　食品学・食品機能学　教授または准教授,教授相当:准教授・常勤専任講師相当,"[""愛知県""]","[""Aichi""]",農学:農学,修文大学
D114100996,2014-10-10,NA:2014-10-28:NA,契約職員 (特別研究員) の募集 (茶業研究領域),研究員・ポスドク相当,"[""静岡県""]","[""Shizuoka""]",農学,独立行政法人農業・食品産業技術総合研究機構
D114100791,2014-10-10,2014-10-10:2014-12-10:NA,教授の公募－京都大学大学院農学研究科・教授（農学原論分野）,教授相当,"[""京都府""]","[""Kyoto""]",農学,京都大学
D114101005,2014-10-10,NA:2014-11-05:NA,契約職員 (特別研究員) の募集 (野菜育種・ゲノム研究領域),研究員・ポスドク相当,"[""三重県""]","[""Mie""]",農学,独立行政法人農業・食品産業技術総合研究機構
D114101003,2014-10-10,NA:2014-11-05:NA,契約職員 (特別研究員) の募集 (野菜生産技術研究領域),研究員・ポスドク相当,"[""茨城県""]","[""Ibaraki""]",農学,独立行政法人農業・食品産業技術総合研究機構
D114100980,2014-10-10,2014年10月27日 消印有効,久留米大学文学部情報社会学科教員(准教授または講師)の公募について,准教授・常勤専任講師相当,"[""福岡県""]","[""Fukuoka""]",情報学:複合領域:社会科学,久留米大学
D114100937,2014-10-10,2014-10-08:2014-11-10:NA,教授または准教授の公募,教授相当:准教授・常勤専任講師相当,"[""東京都""]","[""Tokyo""]",その他:複合領域,東京工業大学
D114100956,2014-10-10,2014-10-10:2014-11-17:NA,専任教員公募（都市健康・スポーツ研究センター所属教員）,助教相当,"[""大阪府""]","[""Osaka""]",複合領域,大阪市立大学
D114100885,2014-10-10,"2014年10月08日 ～,2014年10月20日 消印有効",学術支援専門職員（特定短時間勤務有期雇用教職員）,研究開発・技術者相当,"[""東京都""]","[""Tokyo""]",情報学:その他,東京大学
