id,date,period,subject,title,place,place_en,genre,institution
D114090804,2014-09-18,2014-09-18:2014-10-14:NA,教員の公募（栄養教諭関係科目：栄養指導）,教授相当:准教授・常勤専任講師相当:助教相当,"[""福岡県""]","[""Fukuoka""]",複合領域:その他,九州栄養福祉大学
D114090796,2014-09-18,2014-09-18:2014-10-14:NA,教員の公募（管理栄養士養成関係科目：給食経営管理論）,教授相当:准教授・常勤専任講師相当:助教相当,"[""福岡県""]","[""Fukuoka""]",複合領域:その他,九州栄養福祉大学
D114090746,2014-09-18,2014-09-17:2014-10-14:NA,教員の公募（美容師養成関係科目）,准教授・常勤専任講師相当:助教相当,"[""福岡県""]","[""Fukuoka""]",その他,東筑紫短期大学
D114090778,2014-09-18,2014-09-18:2014-10-14:NA,教員の公募（管理栄養士養成関係科目：基礎栄養学・生化学）,教授相当:准教授・常勤専任講師相当:助教相当,"[""福岡県""]","[""Fukuoka""]",複合領域:化学,九州栄養福祉大学
D114090757,2014-09-18,2014-09-18:2014-12-31:NA,プロジェクトコーディネーター,研究管理者相当,"[""東京都""]","[""Tokyo""]",化学,株式会社UL Japan
D114090783,2014-09-18,NA:2014-11-17:NA,生命科学部　応用化学科　助教（無機化学分野あるいは物理化学分野）募集,助教相当,"[""滋賀県""]","[""Shiga""]",化学:化学:化学,立命館大学
D114090759,2014-09-18,2014-09-17:2014-10-14:NA,教員の公募（食品学関係科目）,教授相当:准教授・常勤専任講師相当:助教相当,"[""福岡県""]","[""Fukuoka""]",農学:複合領域:その他,東筑紫短期大学
D114090815,2014-09-18,2014-09-18:2014-11-07:NA,助教の公募（生化学・プロテオミクス分野）,助教相当,"[""神奈川県""]","[""Kanagawa""]",医歯薬学:生物学:その他,聖マリアンナ医科大学
D114090749,2014-09-18,NA:2014-10-31:１７時必着（期限厳守）,高知大学学生支援開発センター（仮称）特任准教授公募,准教授・常勤専任講師相当,"[""高知県""]","[""Kochi""]",社会科学:社会科学:その他,高知大学
D114090785,2014-09-18,NA:2014-11-11:NA,教員の公募－東北大学大学院農学研究科・教授（環境経済学分野）,教授相当,"[""宮城県""]","[""Miyagi""]",農学,東北大学
D114090761,2014-09-18,NA:2014-11-11:NA,教員の公募－東北大学大学院農学研究科・教授（作物学分野）,教授相当,"[""宮城県""]","[""Miyagi""]",農学,東北大学
D114090763,2014-09-18,NA:2014-11-21:NA,助教の公募（薬品分析化学研究室）,助教相当,"[""岐阜県""]","[""Gifu""]",医歯薬学,岐阜薬科大学
D114090758,2014-09-18,2014-09-17:2015-01-05:募集期間中でも適任者がいた場合は募集を打ち切ることがあります。,「助手の公募（臨床看護学分野）」,研究・教育補助者相当,"[""神奈川県""]","[""Kanagawa""]",医歯薬学,北里大学
D114090750,2014-09-18,NA:2014-10-15:NA,青森県立保健大学看護学科　教員（看護管理学　助教又は助手）公募,助教相当:研究・教育補助者相当,"[""青森県""]","[""Aomori""]",医歯薬学,青森県立保健大学
D114090786,2014-09-18,NA:2014-10-20:適任者がおりましたら募集期間終了前に決定する可能性があります。,研究員・協力員の公募 (腫瘍病理学分野 NEDOプロジェクト),研究・教育補助者相当:研究員・ポスドク相当,"[""埼玉県 東京都""]",[nil],医歯薬学:工学,日本大学
D114080416,2014-09-18,2014-08-07:2014-10-20:※採用者が決定次第、公募終了します。,修文大学　看護学部教員公募（老年看護学　准教授または講師・助教）,准教授・常勤専任講師相当:助教相当,"[""愛知県""]","[""Aichi""]",医歯薬学,修文大学
D114080425,2014-09-18,2014-08-07:2014-10-20:※採用者が決定次第、公募終了します。,修文大学　看護学部教員公募（母性看護学　准教授または講師・助教）,准教授・常勤専任講師相当:助教相当,"[""愛知県""]","[""Aichi""]",医歯薬学,修文大学
D114090771,2014-09-18,2014-09-17:2014-10-14:NA,教員の公募（介護福祉士養成関係科目）,教授相当:准教授・常勤専任講師相当:助教相当,"[""福岡県""]","[""Fukuoka""]",社会科学,東筑紫短期大学
D114090650,2014-09-18,2014-09-18:2014-10-31:2014年10月31日（金）必着のこと。,佛教大学教育学部特別任用教員公募(臨床心理学),教授相当,"[""京都府""]","[""Kyoto""]",社会科学:社会科学,佛教大学
D114090726,2014-09-18,2014-09-18:2014-10-09:NA,助教の公募（看護学専攻（小児看護学））,助教相当,"[""愛媛県""]","[""Ehime""]",医歯薬学,愛媛大学
D114090775,2014-09-18,2014-09-18:2015-03-31:適任者が見つかり次第締め切ります,特任助教の公募（分子腫瘍分野）,助教相当,"[""北海道""]","[""Hokkaido""]",生物学:医歯薬学,北海道大学
D114090651,2014-09-18,2014-09-18:2014-10-24:2014年10月24日（金）必着のこと。,佛教大学社会福祉学部専任教員公募(社会保障、福祉政策),教授相当:准教授・常勤専任講師相当,"[""京都府""]","[""Kyoto""]",社会科学:社会科学:社会科学,佛教大学
D114090660,2014-09-18,2014-09-18:2014-10-24:2014年10月24日（金）必着のこと。,佛教大学社会福祉学部専任教員公募（高齢者福祉、高齢者ケア）,教授相当:准教授・常勤専任講師相当,"[""京都府""]","[""Kyoto""]",社会科学:社会科学,佛教大学
D114090825,2014-09-18,NA:2014-11-04:NA,講師又は准教授の公募（生物学及びその関連分野）,准教授・常勤専任講師相当,"[""富山県""]","[""Toyama""]",生物学:農学:総合生物,富山県立大学
D114090805,2014-09-18,2014-09-17:2014-10-30:NA,東北大学大学院生命科学研究科･生物多様性進化分野の助教の公募,助教相当,"[""宮城県""]","[""Miyagi""]",生物学:生物学,東北大学
D114090722,2014-09-18,2014-09-18:2014-10-30:適任者が見つかり次第、終了します。,【募集】脳科学分野にかかる専門研究員（任期制）または研究補助員（任期制）,研究員・ポスドク相当:研究・教育補助者相当,"[""滋賀県""]","[""Shiga""]",生物学:複合領域,立命館大学
D114061128,2014-09-18,NA:2014-12-30:適任者が見つかるまで,金沢大学バイオAFM先端研究センター(イメージング研究部門)博士研究員募集,研究員・ポスドク相当,"[""石川県""]","[""Ishikawa""]",生物学:複合領域,金沢大学
D114090788,2014-09-18,NA:2014-11-11:NA,教員の公募－東北大学大学院農学研究科・准教授（生物有機化学分野）,准教授・常勤専任講師相当,"[""宮城県""]","[""Miyagi""]",農学,東北大学
D114081240,2014-09-18,NA:2015-03-31:適任者が見つかり次第，締切前でも採用を決定することがあります。,東京大学大学院 工学系研究科 電気系工学専攻特任研究員 公募のお知らせ,研究員・ポスドク相当,"[""東京都""]","[""Tokyo""]",工学:工学:総合理工,東京大学
D114090681,2014-09-18,2014-09-18:2014-11-28:NA,もの創造系領域（航空宇宙システム工学ユニット）准教授または助教の公募,准教授・常勤専任講師相当:助教相当,"[""北海道""]","[""Hokkaido""]",工学:工学:工学,室蘭工業大学
D114090792,2014-09-18,NA:2014-11-11:NA,教員の公募－東北大学大学院農学研究科・准教授（動物生殖科学分野）,准教授・常勤専任講師相当,"[""宮城県""]","[""Miyagi""]",農学,東北大学
D114090741,2014-09-18,2014-09-17:2014-12-26:NA,教員公募（電気情報工学科　助教）,助教相当,"[""愛媛県""]","[""Ehime""]",工学,新居浜工業高等専門学校
D114090751,2014-09-18,NA:2014-12-15:消印有効,助教の公募（電気工学分野）,助教相当,"[""東京都""]","[""Tokyo""]",工学:工学:総合理工,成蹊大学
D114090753,2014-09-18,NA:2014-12-15:NA,助教の公募（材料、加工、設計、計算力学のいずれかに関わる分野）,助教相当,"[""熊本県""]","[""Kumamoto""]",工学,熊本高等専門学校
D114090779,2014-09-18,NA:2014-12-31:終了日前に採用者を決定する可能性あり,臨床工学系学科の専任教員募集,専門学校・小中高等の教員相当,"[""東京都""]","[""Tokyo""]",工学,読売理工医療福祉専門学校
D114090824,2014-09-18,2014-09-18:2014-10-31:NA,コンピュータサイエンス学部　教授または准教授の公募,教授相当:准教授・常勤専任講師相当,"[""東京都""]","[""Tokyo""]",工学:工学,東京工科大学
D114090765,2014-09-18,NA:2014-10-31:NA,愛知学泉大学　非常勤講師の公募（経営学分野）,非常勤講師相当,"[""愛知県""]","[""Aichi""]",社会科学,愛知学泉大学
D114090766,2014-09-18,NA:2014-10-31:NA,愛知学泉大学　非常勤講師の公募（法学分野）,非常勤講師相当,"[""愛知県""]","[""Aichi""]",社会科学,愛知学泉大学
D114090776,2014-09-18,2014-09-17:2014-11-07:NA,非常勤講師の公募（消費経済）,非常勤講師相当,"[""栃木県""]","[""Tochigi""]",社会科学,宇都宮共和大学
D114090780,2014-09-18,2014-09-18:2014-11-19:NA,教員の公募（教育心理学(発達と教育，心理統計他)・准教授または講師）,准教授・常勤専任講師相当,"[""北海道""]","[""Hokkaido""]",社会科学,北海道教育大学
D114090793,2014-09-18,2014-09-26:2014-10-31:NA,教授または准教授または講師の公募（教科教育学（理科））,教授相当:准教授・常勤専任講師相当,"[""富山県""]","[""Toyama""]",社会科学,富山国際大学
D114090814,2014-09-18,NA:2014-10-15:消印有効,教員の公募（社会学専攻分野）,准教授・常勤専任講師相当,"[""宮城県""]","[""Miyagi""]",社会科学,東北大学
D114090828,2014-09-18,2014-09-16:2014-10-22:NA,専任教員（助教）の公募（現代文化学部こども文化学科）,助教相当,"[""東京都""]","[""Tokyo""]",社会科学,東京純心女子大学
D114090784,2014-09-18,2014-09-17:2014-10-17:NA,講師（任期制）の公募（サービスマネジメント分野、マーケティング分野）,准教授・常勤専任講師相当,"[""滋賀県""]","[""Shiga""]",複合領域,立命館大学
D114090739,2014-09-18,2014-09-17:2014-11-30:NA,専任教員公募（保育士、幼児教諭２種養成）,専門学校・小中高等の教員相当,"[""静岡県""]","[""Shizuoka""]",複合領域,浜松医療福祉専門学校
D114090818,2014-09-18,2014-09-18:2014-10-14:NA,教員の公募（管理栄養士養成関係科目：食べ物と健康、食品加工学）,教授相当:准教授・常勤専任講師相当:助教相当,"[""福岡県""]","[""Fukuoka""]",複合領域:農学,九州栄養福祉大学
D114090789,2014-09-18,2014-09-04:2014-12-15:NA,臨床看護学講座（母性看護学および助産学）助教候補者の推薦,助教相当,"[""島根県""]","[""Shimane""]",医歯薬学,島根大学
D114090748,2014-09-18,2014-09-17:2014-10-14:NA,教員の公募（情報処理関係科目）,教授相当:准教授・常勤専任講師相当:助教相当,"[""福岡県""]","[""Fukuoka""]",情報学:社会科学,東筑紫短期大学
D114090797,2014-09-18,2014-09-16:2014-10-17:NA,公立大学法人大阪府立大学大学院看護学研究科の専任教員（生活支援看護学領域 在宅看護学分野 准教授）の公募について,准教授・常勤専任講師相当,"[""大阪府""]","[""Osaka""]",医歯薬学,大阪府立大学
D114090800,2014-09-18,2014-09-17:2014-11-30:募集期間終了日までに書類必着のこと,教員(精神看護学　助教）の公募について,助教相当,"[""高知県""]","[""Kochi""]",医歯薬学,高知県立大学
D114090802,2014-09-18,2014-09-17:2014-11-30:募集期間終了日までに書類必着のこと,教員(基礎看護学・家族看護学　助教）の公募について,助教相当,"[""高知県""]","[""Kochi""]",医歯薬学,高知県立大学
D114090803,2014-09-18,2014-09-17:2014-10-27:NA,コミュニティヘルス看護学の准教授/講師の公募について,准教授・常勤専任講師相当,"[""岡山県""]","[""Okayama""]",医歯薬学,岡山大学
D114090790,2014-09-18,NA:2014-11-10:NA,生命科学部　生命情報学科　助教（フィジオーム、バイオシミュレーションに関する分野）募集,助教相当,"[""滋賀県""]","[""Shiga""]",情報学:総合生物:生物学,立命館大学
D114090801,2014-09-18,NA:2014-10-24:NA,教員（一般教育科）の公募（物理担当）,准教授・常勤専任講師相当:助教相当,"[""東京都""]","[""Tokyo""]",数物系科学,東京工業高等専門学校
D114090794,2014-09-18,NA:2014-10-24:NA,教員（一般教育科）の公募（数学担当）,教授相当:准教授・常勤専任講師相当:助教相当,"[""東京都""]","[""Tokyo""]",数物系科学,東京工業高等専門学校
D114090682,2014-09-18,2014-09-18:2014-12-01:NA,ひと文化系領域（数理科学ユニット）教授の公募,教授相当,"[""北海道""]","[""Hokkaido""]",数物系科学,室蘭工業大学
D114090826,2014-09-18,2014-10-01:2014-10-21:10月21日(火)までの消印のあるものまで受付,和歌山県立博物館　学芸員の公募（日本美術史、絵画･工芸）,研究員・ポスドク相当:学芸員,"[""和歌山県""]","[""Wakayama""]",人文学,和歌山県立博物館
D114090688,2014-09-18,2014-09-18:2014-10-25:NA,国際政治経済学部 特任教員（任期制）の公募（英語）,准教授・常勤専任講師相当,"[""千葉県 東京都""]",[nil],人文学:人文学,二松学舎大学
D114090752,2014-09-18,NA:2014-10-31:NA,専任教員の公募（日本史）,教授相当:准教授・常勤専任講師相当,"[""愛知県""]","[""Aichi""]",人文学:社会科学,名古屋商科大学
D114090777,2014-09-18,2014-09-17:2014-11-07:NA,非常勤講師の公募（英語）,非常勤講師相当,"[""栃木県""]","[""Tochigi""]",人文学,宇都宮共和大学
D114090791,2014-09-18,NA:2014-10-24:NA,教員（一般教育科）の公募（国語担当）,准教授・常勤専任講師相当:助教相当,"[""東京都""]","[""Tokyo""]",人文学:人文学,東京工業高等専門学校
D114090823,2014-09-18,NA:2014-11-07:消印有効,教員の公募（哲学専攻分野）,准教授・常勤専任講師相当,"[""宮城県""]","[""Miyagi""]",人文学,東北大学
D114090822,2014-09-18,NA:2014-11-14:NA,講師又は准教授の公募（物理学及びその関連分野）,准教授・常勤専任講師相当,"[""富山県""]","[""Toyama""]",数物系科学:総合理工,富山県立大学
D114090655,2014-09-18,NA:2014-10-20:NA,准教授または助教1名の公募（情報系数学分野）,准教授・常勤専任講師相当:助教相当,"[""茨城県""]","[""Ibaraki""]",数物系科学:数物系科学:数物系科学,茨城大学
D114090807,2014-09-18,NA:2014-11-28:NA,薬学部 助教の募集（「分子神経生物学、ゲノム編集」および関連分野）,助教相当,"[""滋賀県""]","[""Shiga""]",医歯薬学:医歯薬学,立命館大学
D114090813,2014-09-18,NA:2015-09-18:候補者決定次第締め切り,研究員または特別研究員募集(統計解析研究チーム),研究員・ポスドク相当,"[""神奈川県""]","[""Kanagawa""]",情報学:医歯薬学:生物学,独立行政法人理化学研究所
D114090806,2014-09-18,2014-09-17:2014-11-30:募集期間終了日までに書類必着のこと,教員（総合看護学・がん看護学の准教授または講師）の公募について,准教授・常勤専任講師相当,"[""高知県""]","[""Kochi""]",医歯薬学,高知県立大学
D114090702,2014-09-17,NA:2015-04-27:NA,教授，准教授，助教または助手の公募（機械工学科）,教授相当:准教授・常勤専任講師相当:助教相当:研究・教育補助者相当,"[""愛知県""]","[""Aichi""]",工学,豊田工業高等専門学校
D114090704,2014-09-17,NA:2014-11-10:締め切り日に必着でお願いします,教授または准教授の公募 （防災地質学分野，JABEE担当）,教授相当:准教授・常勤専任講師相当,"[""茨城県""]","[""Ibaraki""]",数物系科学,茨城大学
D114090673,2014-09-17,2014-09-16:2014-10-16:NA,研究支援職の募集,研究・教育補助者相当,"[""広島県""]","[""Hiroshima""]",生物学,株式会社ツーセル
D114090692,2014-09-17,2014-09-16:2014-10-31:NA,助教１名の公募（生物科学分野 動物系統分類学分野）,助教相当,"[""茨城県""]","[""Ibaraki""]",生物学,筑波大学
D114090663,2014-09-17,NA:2014-10-24:平成26年10月24日（金）必着。なお、応募の締切日は平成26年10月24日（金）必着となっていますが、応募書類到着の方から順次選考を行い、選考の結果、採用候補者が内定次第、応募を締め切ります。,専任技術職員の公募について（生活学科）,研究・教育補助者相当,"[""愛知県""]","[""Aichi""]",情報学,名古屋女子大学短期大学部
D114090432,2014-09-17,NA:2014-12-01:締切はとくに設けません。採用者が決定し次第、募集を打ち切ります。募集の終了は次のページでお知らせします。http://www.cl.ecei.tohoku.ac.jp/index.php?PD-140902,特任教員（特任准教授、特任助教）・研究員の募集（東北大学 乾・岡崎研究室、自然言語処理・情報学分野）,研究員・ポスドク相当:准教授・常勤専任講師相当:助教相当,"[""宮城県""]","[""Miyagi""]",情報学,東北大学
D114090216,2014-09-17,NA:2014-11-10:NA,嘱託助教の募集(情報科学分野),助教相当,"[""東京都""]","[""Tokyo""]",情報学,東京理科大学
D114090656,2014-09-17,NA:2014-10-24:平成26年10月24日（金）必着。なお、応募の締切日は平成26年10月24日（金）必着となっていますが、応募書類到着の方から順次選考を行い、選考の結果、採用候補者が内定次第、応募を締め切ります。,教員の公募について（保育学科、保育内容）,教授相当:准教授・常勤専任講師相当,"[""愛知県""]","[""Aichi""]",社会科学:その他,名古屋女子大学短期大学部
D114090657,2014-09-17,NA:2014-10-24:平成26年10月24日（金）必着。なお、応募の締切日は平成26年10月24日（金）必着となっていますが、応募書類到着の方から順次選考を行い、選考の結果、採用候補者が内定次第、応募を締め切ります。,教員の公募について（保育学科、乳児保育）,教授相当:准教授・常勤専任講師相当,"[""愛知県""]","[""Aichi""]",社会科学:その他,名古屋女子大学短期大学部
D114090659,2014-09-17,NA:2014-10-24:平成26年10月24日（金）必着。なお、応募の締切日は平成26年10月24日（金）必着となっていますが、応募書類到着の方から順次選考を行い、選考の結果、採用候補者が内定次第、応募を締め切ります。,教員の公募について（保育学科、教育原理）,教授相当:准教授・常勤専任講師相当,"[""愛知県""]","[""Aichi""]",社会科学:その他,名古屋女子大学短期大学部
D114090661,2014-09-17,NA:2014-10-24:平成26年10月24日（金）必着。なお、応募の締切日は平成26年10月24日（金）必着となっていますが、応募書類到着の方から順次選考を行い、選考の結果、採用候補者が内定次第、応募を締め切ります。,教員の公募について（生活学科、食品学）,教授相当:准教授・常勤専任講師相当,"[""愛知県""]","[""Aichi""]",複合領域:その他,名古屋女子大学短期大学部
D114090667,2014-09-17,NA:2014-10-24:平成26年10月24日（金）必着。なお、応募の締切日は平成26年10月24日（金）必着となっていますが、応募書類到着の方から順次選考を行い、選考の結果、採用候補者が内定次第、応募を締め切ります。,専任技術職員の公募について（食物栄養学科）,研究・教育補助者相当,"[""愛知県""]","[""Aichi""]",複合領域:その他,名古屋女子大学
D114090699,2014-09-17,2014-09-17:2015-03-31:採用者が決まり次第公募終了,シミュレータ研究開発者の募集,研究開発・技術者相当,"[""茨城県""]","[""Ibaraki""]",工学:情報学,株式会社トプスシステムズ
D114090730,2014-09-17,2014-09-17:2014-10-30:NA,胸部心臓血管外科学講座呼吸器外科担当診療教授候補者の推薦について（依頼）,教授相当,"[""大阪府""]","[""Osaka""]",医歯薬学:医歯薬学,関西医科大学
D114090729,2014-09-17,NA:2014-12-22:NA,看護学部 准教授または講師の公募（ヘルスプロモーション看護学）,准教授・常勤専任講師相当,"[""福岡県""]","[""Fukuoka""]",医歯薬学,福岡県立大学
D114090728,2014-09-17,2014-09-17:2014-11-13:NA,病態検査学講座担当教授候補者の推薦について（依頼）,教授相当,"[""大阪府""]","[""Osaka""]",医歯薬学:医歯薬学:医歯薬学,関西医科大学
D114090723,2014-09-17,NA:2015-09-17:候補者決定次第締め切り,研究員もしくは特別研究員募集（国際ゲノム連携研究チーム）,研究員・ポスドク相当,"[""神奈川県""]","[""Kanagawa""]",医歯薬学:生物学,独立行政法人理化学研究所
D114090717,2014-09-17,NA:2014-10-31:NA,徳島大学疾患酵素学研究センター（疾患プロテオミクス研究部門）准教授、講師または助教の公募（期間延長）,准教授・常勤専任講師相当:助教相当,"[""徳島県""]","[""Tokushima""]",生物学:医歯薬学:複合領域,徳島大学
D114090715,2014-09-17,2014-09-17:2014-10-31:NA,看護学部看護学科　精神看護学教授の公募,教授相当,"[""秋田県""]","[""Akita""]",医歯薬学,日本赤十字秋田看護大学
D114090714,2014-09-17,NA:2014-12-01:募集終了日前に採用者を決定する可能性がある 。,【公募】「小児看護」担当　専任教員公募　（保健医療学部）,教授相当:准教授・常勤専任講師相当:助教相当,"[""大阪府""]","[""Osaka""]",医歯薬学:医歯薬学:医歯薬学,大和大学
D114090712,2014-09-17,2014-09-17:2014-10-31:NA,さいたま医療センター循環器病臨床医学研究所　教授の公募,教授相当,"[""埼玉県""]","[""Saitama""]",医歯薬学:医歯薬学,自治医科大学
D114090697,2014-09-17,NA:2014-11-28:NA,神戸大学大学院保健学研究科地域保健学領域　地域保健学分野　教授　１名 の公募,教授相当,"[""兵庫県""]","[""Hyōgo""]",医歯薬学,神戸大学
D114090696,2014-09-17,2014-09-12:2014-10-31:NA,精神看護学研究室教員（助教）の公募について,助教相当,"[""東京都""]","[""Tokyo""]",医歯薬学,東邦大学
D114090693,2014-09-17,NA:2014-12-31:適任者が決まり次第締め切り,大阪市大ーあべのハルカスで研究補助員の募集（生物科学分野）,研究・教育補助者相当,"[""大阪府""]","[""Osaka""]",医歯薬学,大阪市立大学
D114090691,2014-09-17,NA:2014-10-31:NA,専任教員（助教又は助手)の公募（理学療法学・運動器）,助教相当:研究・教育補助者相当,"[""宮城県""]","[""Miyagi""]",医歯薬学,東北文化学園大学
D114090678,2014-09-17,2014-09-15:2014-10-31:NA,専任教育職員の募集について（看護学科（精神看護学））,准教授・常勤専任講師相当:教授相当,"[""岐阜県""]","[""Gifu""]",医歯薬学,大垣女子短期大学
D114090672,2014-09-17,NA:2014-11-30:適任者が決定次第終了,ポスドク研究員募集（革新的バイオセンサ・ガスセンサの研究・開発）,研究員・ポスドク相当,"[""茨城県""]","[""Ibaraki""]",総合理工:医歯薬学:総合理工,独立行政法人物質・材料研究機構
D114090671,2014-09-17,NA:2014-10-31:NA,専任教員（助教又は助手)の公募（老年看護学）,助教相当:研究・教育補助者相当,"[""宮城県""]","[""Miyagi""]",医歯薬学,東北文化学園大学
D114090668,2014-09-17,2014-09-12:2014-10-31:NA,基礎看護学研究室教員（准教授）の公募について,准教授・常勤専任講師相当,"[""東京都""]","[""Tokyo""]",医歯薬学,東邦大学
D114090666,2014-09-17,2014-09-15:2014-10-31:NA,専任教育職員の募集について（歯科衛生科）,助教相当:准教授・常勤専任講師相当,"[""岐阜県""]","[""Gifu""]",医歯薬学,大垣女子短期大学
D114090664,2014-09-17,NA:2014-11-20:NA,新潟県立大学人間生活学部健康栄養学科専任教員(公衆衛生学）の公募について,教授相当,"[""新潟県""]","[""Niigata""]",医歯薬学:複合領域,新潟県立大学
D114090587,2014-09-17,2014-09-17:2014-10-17:NA,麻酔科学講座区域麻酔担当診療教授候補者の推薦について（期間延長）,教授相当,"[""大阪府""]","[""Osaka""]",医歯薬学,関西医科大学
D114090689,2014-09-17,NA:2014-10-31:NA,教授の公募（理学療法学専攻・解剖学）,教授相当,"[""宮城県""]","[""Miyagi""]",医歯薬学,東北文化学園大学
D114090690,2014-09-17,NA:2014-10-31:NA,専任教員（准教授・理学療法学）の公募（小児、発達障害分野）,准教授・常勤専任講師相当,"[""宮城県""]","[""Miyagi""]",医歯薬学,東北文化学園大学
