id,date,period,subject,title,place,place_en,genre,institution
D113110625,2014-09-02,2013-11-15:2015-03-31:応募が有り次第審査をして採否を決定し、充足すれば締め切ります。,長崎臨床研究部 研究員（任期付）の募集,研究員・ポスドク相当,"[""長崎県""]","[""Nagasaki""]",医歯薬学,公益財団法人放射線影響研究所
D114080876,2014-09-02,NA:2014-11-07:NA,助教または助手の公募（精神看護学領域）について,助教相当:研究・教育補助者相当,"[""福井県""]","[""Fukui""]",医歯薬学,福井県立大学
D114090003,2014-09-02,2014-09-01:2014-12-20:適任者が決まり次第募集を終了致します。,技術補佐員の募集｛急募｝,研究・教育補助者相当,"[""福岡県""]","[""Fukuoka""]",生物学:医歯薬学:農学,九州大学
D114090006,2014-09-02,2014-09-01:2014-12-10:NA,協奏分子システム研究センター 階層分子システム解析研究部門　助教公募,助教相当,"[""愛知県""]","[""Aichi""]",生物学:化学:情報学,自然科学研究機構分子科学研究所
D114090007,2014-09-02,2014-09-01:2014-10-31:NA,准教授の公募（母子看護学分野（小児看護学））,准教授・常勤専任講師相当,"[""熊本県""]","[""Kumamoto""]",医歯薬学,熊本大学
D114090009,2014-09-02,2014-09-01:2014-10-31:NA,医学部皮膚科学講座主任教授候補者の公募について,教授相当,"[""福岡県""]","[""Fukuoka""]",医歯薬学,久留米大学
D114090019,2014-09-02,2014-09-02:2014-12-24:NA,【高エネ機構】加速器研究施設教員公募　加速器14-5（助教）,助教相当,"[""茨城県""]","[""Ibaraki""]",数物系科学,高エネルギー加速器研究機構
D114090020,2014-09-02,2014-09-02:2014-12-24:NA,【高エネ機構】加速器研究施設教員公募　加速器14-6（特別助教）,助教相当,"[""茨城県""]","[""Ibaraki""]",数物系科学,高エネルギー加速器研究機構
D114090021,2014-09-02,2014-09-02:2014-12-24:NA,【高エネ機構】加速器研究施設教員公募　加速器14-7（博士研究員）,研究員・ポスドク相当,"[""茨城県""]","[""Ibaraki""]",数物系科学,高エネルギー加速器研究機構
D114090015,2014-09-02,2014-09-02:2014-10-31:NA,特任助教またはポスドクの公募（造血・自然免疫研究分野）,助教相当:研究員・ポスドク相当,"[""熊本県""]","[""Kumamoto""]",医歯薬学:生物学,熊本大学
D114090023,2014-09-02,2014-09-02:2015-03-31:締め切りを待たずに決定する場合があります,特任助教の公募（神経科学分野）,助教相当,"[""福島県""]","[""Fukushima""]",総合生物:医歯薬学,福島県立医科大学
D114090032,2014-09-02,2014-09-01:2014-10-31:NA,准教授または講師（薬事）候補者の再公募,准教授・常勤専任講師相当,"[""群馬県""]","[""Gunma""]",医歯薬学:生物学:複合領域,群馬大学
D114090018,2014-09-02,2014-09-02:2014-10-14:NA,教授公募(複雑系力学講座),教授相当,"[""京都府""]","[""Kyoto""]",数物系科学:情報学,京都大学
D114081261,2014-09-02,NA:2014-10-17:当日消印有効,久留米大学文学部国際文化学科(国語学)教員(准教授または講師)の公募について(公募期間延長),准教授・常勤専任講師相当,"[""福岡県""]","[""Fukuoka""]",人文学:人文学,久留米大学
D114090031,2014-09-02,NA:2014-10-14:NA,東京工業大学 大学院情報理工学研究科 数理・計算科学専攻 教授の公募,教授相当,"[""東京都""]","[""Tokyo""]",情報学,東京工業大学
D114081260,2014-09-02,NA:2014-10-31:NA,佐賀大学総合分析実験センター　助教の公募（生物資源開発部門）,助教相当,"[""佐賀県""]","[""Saga""]",総合生物:農学,佐賀大学
D114090008,2014-09-02,2014-09-01:2014-10-31:NA,大学共同利用機関法人自然科学研究機構生理学研究所発達生理学研究系認知行動発達機構研究部門特任助教（または博士研究員（ポスドク））（プロジェクト）公募,助教相当:研究員・ポスドク相当,"[""愛知県""]","[""Aichi""]",総合生物,自然科学研究機構生理学研究所
D114090026,2014-09-02,2014-09-02:2014-11-01:適任者が見つかり次第募集を締め切らせていただきます。,環境・資源・エネルギー分野における経済学的分析に関する研究員の募集,研究員・ポスドク相当,"[""宮城県""]","[""Miyagi""]",社会科学:複合領域:情報学,東北大学
D114060982,2014-09-01,2014-06-19:2014-10-31:公募期間の延長,大学院理工学研究科生産環境工学専攻機械工学講座　教員公募,准教授・常勤専任講師相当,"[""愛媛県""]","[""Ehime""]",工学,愛媛大学
D114081249,2014-09-01,NA:2014-11-15:NA,教授または准教授の公募（キャリア教育）,教授相当:准教授・常勤専任講師相当,"[""福島県""]","[""Fukushima""]",複合領域,いわき明星大学
D114081176,2014-09-01,NA:2014-10-15:NA,公立大学法人首都大学東京の教員公募（大学教育センター・助教）情報教育、教育工学,助教相当,"[""東京都""]","[""Tokyo""]",複合領域,首都大学東京
D114081247,2014-09-01,NA:2014-11-15:NA,教授または准教授の公募（マーケティング系（サービス、消費者行動）分野）,教授相当:准教授・常勤専任講師相当,"[""福島県""]","[""Fukushima""]",社会科学,いわき明星大学
D114081211,2014-09-01,NA:2014-10-31:NA,東京農工大学　大学院工学研究院先端機械システム部門　教授公募,教授相当,"[""東京都""]","[""Tokyo""]",工学:工学:工学,東京農工大学
D114081168,2014-09-01,2014-09-01:2014-10-30:午後５時（必着）,全学技術センター技術職員募集(装置開発・機械加工),研究・教育補助者相当,"[""愛知県""]","[""Aichi""]",工学:工学:総合理工,名古屋大学
D114081036,2014-09-01,2014-09-01:2014-10-31:NA,助教の公募（徳島大学インスティトゥーショナル・リサーチ室）,助教相当,"[""徳島県""]","[""Tokushima""]",情報学:社会科学,徳島大学
D114081225,2014-09-01,2014-09-01:2014-11-30:適任者が決定次第締め切る可能性があります。,名古屋大学大学院工学研究科博士研究員の募集,研究員・ポスドク相当,"[""愛知県""]","[""Aichi""]",工学:数物系科学:化学,名古屋大学
D114081055,2014-09-01,2014-09-01:2014-10-31:NA,国際交流に係る特命教員の公募について,教授相当:准教授・常勤専任講師相当,"[""福井県""]","[""Fukui""]",人文学:社会科学,福井県立大学
D114080010,2014-09-01,2014-09-01:2015-03-31:採用者が決まり次第、公募を終了とさせて頂きます。,モデル開発研究員・リスクアナリストの公募（地震災害分野）,研究開発・技術者相当:研究員・ポスドク相当,"[""東京都""]","[""Tokyo""]",工学:数物系科学:工学,損保ジャパン日本興亜リスクマネジメント株式会社
D114080009,2014-09-01,2014-09-01:2015-03-31:採用者が決まり次第、公募を終了とさせて頂きます。,モデル開発研究員・リスクアナリストの公募（風水災害分野）,研究開発・技術者相当:研究員・ポスドク相当,"[""東京都""]","[""Tokyo""]",工学:数物系科学:工学,損保ジャパン日本興亜リスクマネジメント株式会社
D114081204,2014-09-01,NA:2014-10-31:NA,熊本大学大学院自然科学研究科産業創造工学専攻マテリアル工学講座　女性教員公募,助教相当:教授相当:准教授・常勤専任講師相当,"[""熊本県""]","[""Kumamoto""]",工学,熊本大学
D114081103,2014-09-01,2014-09-01:2015-01-15:適任者が決定次第、募集を締切ります。,JST・ERATO 佐藤ライブ予測制御プロジェクト 研究員募集 (数理系),研究員・ポスドク相当,"[""京都府""]","[""Kyoto""]",情報学,【SBIR】株式会社国際電気通信基礎技術研究所(ATR)
D114060545,2014-09-01,NA:2014-12-15:急募　採用者が決まり次第公募終了,講師、助教または助手の公募（成人看護学、基礎看護学、精神看護学）,准教授・常勤専任講師相当:助教相当:研究・教育補助者相当,"[""大阪府""]","[""Osaka""]",医歯薬学,藍野大学短期大学部
D114081221,2014-09-01,2014-09-01:2014-12-05:NA,金融・経済研究員の公募,研究員・ポスドク相当,"[""東京都""]","[""Tokyo""]",社会科学,日本銀行
D114081192,2014-09-01,2014-09-01:2014-10-31:NA,獣医寄生虫学教授の公募,教授相当,"[""青森県""]","[""Aomori""]",農学:医歯薬学,北里大学
D114081101,2014-09-01,2014-09-01:2015-01-15:適任者が決定次第、募集を締切ります。,JST・ERATO 佐藤ライブ予測制御プロジェクト 研究員募集 (実験系),研究員・ポスドク相当,"[""京都府""]","[""Kyoto""]",生物学:医歯薬学:複合領域,【SBIR】株式会社国際電気通信基礎技術研究所(ATR)
D114081253,2014-09-01,2014-09-01:2014-12-31:NA,常勤講師の公募 （精神保健福祉分野）,専門学校・小中高等の教員相当,"[""大阪府""]","[""Osaka""]",社会科学:社会科学,大阪バイオメディカル専門学校
D114081222,2014-08-30,2014-08-29:2014-10-31:NA,生理化学准教授または助教の公募について,准教授・常勤専任講師相当:助教相当,"[""茨城県""]","[""Ibaraki""]",医歯薬学,筑波大学
D114081259,2014-08-30,2014-08-29:2014-10-17:NA,教員公募（臨床分析化学教室：教授）－東北薬科大学,教授相当,"[""宮城県""]","[""Miyagi""]",医歯薬学,東北薬科大学
D114081232,2014-08-30,NA:2014-11-30:適任者が決まり次第締め切り,産総研特別研究員募集(理論チーム：A14-02),研究員・ポスドク相当,"[""茨城県""]","[""Ibaraki""]",化学:工学:総合理工,独立行政法人産業技術総合研究所
D114081226,2014-08-30,NA:2014-11-30:適任者が決まり次第締め切り,産総研特別研究員募集(金属スピントロニクスチーム・電圧スピントロニクスチーム：A14-03),研究員・ポスドク相当,"[""茨城県""]","[""Ibaraki""]",化学:化学:総合理工,独立行政法人産業技術総合研究所
D114081217,2014-08-30,2014-09-01:2014-12-31:募集終了日前に採用者を決定する可能性があります,博士研究員（特任助教）の募集「健康・医療センサの研究開発」,助教相当,"[""宮城県""]","[""Miyagi""]",総合理工:工学:化学,東北大学
D114081227,2014-08-30,NA:2014-10-31:NA,東洋大学理工学部応用化学科非常勤講師（担当科目：生体高分子）の公募,非常勤講師相当,"[""埼玉県""]","[""Saitama""]",化学,東洋大学
D114081258,2014-08-30,2014-08-29:2014-10-17:NA,准教授，講師または助教の公募（電気・電子システム工学科）,准教授・常勤専任講師相当:助教相当,"[""愛知県""]","[""Aichi""]",工学,豊田工業高等専門学校
D114081056,2014-08-30,NA:2014-10-20:NA,研究員　もしくは　技術研究員　【海洋掘削科学研究開発センター　沈み込み帯掘削研究グループ】,研究員・ポスドク相当,"[""神奈川県""]","[""Kanagawa""]",数物系科学,独立行政法人海洋研究開発機構
D114081164,2014-08-30,NA:2014-11-25:NA,電気通信大学先進理工学専攻准教授の公募,准教授・常勤専任講師相当,"[""東京都""]","[""Tokyo""]",数物系科学:総合理工,電気通信大学
D114081218,2014-08-30,NA:2014-10-31:NA,助教の公募（機械工作の分野）,助教相当,"[""宮崎県""]","[""Miyazaki""]",工学,都城工業高等専門学校
D114081251,2014-08-30,NA:2014-12-01:NA,教員公募（電気工学科・教授または助教）,教授相当:助教相当,"[""奈良県""]","[""Nara""]",工学,奈良工業高等専門学校
D114081219,2014-08-30,NA:2014-10-17:NA,麻布大学 獣医学部 生産獣医学系動物衛生分野 教員公募,准教授・常勤専任講師相当:助教相当,"[""神奈川県""]","[""Kanagawa""]",農学,麻布大学
D114081210,2014-08-29,NA:2014-11-29:適任者が決まり次第終了。,事務業務員（施設系技術担当者）(任期制)募集(施設課),研究・教育補助者相当,"[""茨城県""]","[""Ibaraki""]",複合領域,独立行政法人物質・材料研究機構
D114081212,2014-08-29,NA:2014-10-17:NA,麻布大学 獣医学部 病態獣医学系 微生物学分野 教員公募,准教授・常勤専任講師相当,"[""神奈川県""]","[""Kanagawa""]",農学,麻布大学
D114081178,2014-08-29,2014-08-28:2014-11-14:NA,前橋工科大学社会環境工学科教員公募「准教授または講師（コンクリート工学分野）」,准教授・常勤専任講師相当,"[""群馬県""]","[""Gunma""]",工学,前橋工科大学
D114081191,2014-08-29,NA:2015-02-02:NA,教員の公募（建設システム工学科）,助教相当:准教授・常勤専任講師相当,"[""京都府""]","[""Kyoto""]",工学,舞鶴工業高等専門学校
D114081197,2014-08-29,NA:2014-10-31:NA,東北大学教員（助教）公募,助教相当,"[""宮城県""]","[""Miyagi""]",工学:工学,東北大学
D114081214,2014-08-29,2014-08-29:2014-10-31:NA,教員の公募（情報通信システム工学科　助教）,助教相当,"[""沖縄県""]","[""Okinawa""]",工学:数物系科学:数物系科学,沖縄工業高等専門学校
D114081187,2014-08-29,NA:2014-10-31:NA,准教授または講師の公募（経済学）,准教授・常勤専任講師相当,"[""福岡県""]","[""Fukuoka""]",社会科学,福岡県立大学
D114081135,2014-08-29,2014-08-27:2014-10-31:NA,【貿易実務検定®】非常勤講師募集,非常勤講師相当,"[""神奈川県"", ""その他""]","[""Kanagawa"", nil]",社会科学,株式会社マウンハーフジャパン
D114081133,2014-08-29,2014-08-26:2014-10-31:NA,【ビジネス英語】非常勤講師募集,非常勤講師相当,"[""神奈川県"", ""その他""]","[""Kanagawa"", nil]",社会科学,株式会社マウンハーフジャパン
D114060474,2014-08-29,NA:2014-10-31:募集期間を延長しました。,【募集期間延長】准教授又は講師の公募（保育学・幼児教育学分野）,准教授・常勤専任講師相当,"[""岩手県""]","[""Iwate""]",社会科学:社会科学:社会科学,岩手県立大学
D114030745,2014-08-29,NA:2014-10-31:順次面接、決定次第締切る,研究助手募集　　（化学研究グループ　材料開発担当）,研究・教育補助者相当,"[""京都府""]","[""Kyoto""]",工学:化学,公益財団法人地球環境産業技術研究機構
D114081195,2014-08-29,NA:2014-10-23:NA,産業技術大学院大学　産業技術研究科　教授あるいは准教授の公募（情報システム分野）,教授相当:准教授・常勤専任講師相当,"[""東京都""]","[""Tokyo""]",情報学:複合領域,産業技術大学院大学
D114081024,2014-08-29,2014-08-25:2014-11-30:募集終了日前に採用者を決定する場合があります。,研究員もしくは研究補助員の募集,研究員・ポスドク相当:研究・教育補助者相当,"[""大阪府""]","[""Osaka""]",医歯薬学:総合理工,大阪大谷大学
D114081203,2014-08-29,NA:2014-11-29:採用者が決定次第締め切り,テクニカルスタッフ募集(研究環境安全チーム),研究・教育補助者相当,"[""茨城県""]","[""Ibaraki""]",複合領域:工学:医歯薬学,独立行政法人産業技術総合研究所
D114060305,2014-08-29,2014-09-01:2015-01-31:NA,メディカルコピーライター募集（東京・大阪）,メディカルコピーライター,"[""東京都"", ""大阪府""]","[""Tokyo"", ""Osaka""]",医歯薬学:生物学:化学,株式会社エム・シー・アンド・ピー
D114081206,2014-08-29,NA:2015-08-29:ポストが埋まり次第締め切り,研究員・特別研究員・リサーチアソシエイト・技師・テクニカルスタッフ募集(FAIU1401)(機能構築イメージングユニット),研究員・ポスドク相当:研究・教育補助者相当,"[""兵庫県""]","[""Hyōgo""]",医歯薬学:生物学:総合生物,独立行政法人理化学研究所
D114030747,2014-08-29,NA:2014-10-31:順次面接、決定次第締切る,ポスドク研究員募集　　（化学研究グループ　材料開発担当）,研究員・ポスドク相当,"[""京都府""]","[""Kyoto""]",工学:化学,公益財団法人地球環境産業技術研究機構
D114081177,2014-08-29,2014-08-27:2014-10-17:NA,【公募】大学院保健学研究科看護学講座（医療基礎学）准教授又は講師の公募,准教授・常勤専任講師相当,"[""群馬県""]","[""Gunma""]",医歯薬学:人文学:社会科学,群馬大学
D114081066,2014-08-29,NA:2014-12-01::適任者が決まり次第、応募を締め切ります,特任助教（博士研究員）の募集（東京医科歯科大・難治疾患研究所・分子神経科学）,研究員・ポスドク相当:助教相当,"[""東京都""]","[""Tokyo""]",医歯薬学:生物学,東京医科歯科大学
D114081155,2014-08-28,2014-08-27:2014-10-24:NA,【公募】大学院保健学研究科生体情報検査科学講座（応用検査学）准教授の公募,准教授・常勤専任講師相当,"[""群馬県""]","[""Gunma""]",医歯薬学,群馬大学
D114081160,2014-08-28,NA:2014-11-28:随時募集　※但し、採用者が決定次第、締め切ります。,テクニカルスタッフ募集(エネルギーネットワークチーム)－水素関連設備、蓄熱槽、太陽熱集熱器等の評価に関わる研究補助－,研究・教育補助者相当,"[""福島県""]","[""Fukushima""]",工学:工学,独立行政法人産業技術総合研究所
D114081147,2014-08-28,NA:2014-11-28:随時募集　※但し、採用者が決定次第締め切ります。,テクニカルスタッフ募集（福島再生可能エネルギー研究所）－施設・安全管理等－,研究・教育補助者相当,"[""福島県""]","[""Fukushima""]",医歯薬学:その他,独立行政法人産業技術総合研究所
D114081149,2014-08-28,2014-08-27:2014-10-31:NA,脳神経外科学講座主任教授候補者公募,教授相当,"[""東京都""]","[""Tokyo""]",医歯薬学,東京女子医科大学
D114070102,2014-08-28,NA:2014-10-15:ただし、適任者が決定次第終了します。,リサーチ・アドミニストレーターもしくは国際コーディネーター募集：熊本大学エイズ学研究センター,研究管理者相当,"[""熊本県""]","[""Kumamoto""]",医歯薬学,熊本大学
D114081166,2014-08-28,2014-08-27:2014-11-17:11月17日必着のこと,九州大学大学院工学研究院機械工学部門（材料力学講座）准教授募集,准教授・常勤専任講師相当,"[""福岡県""]","[""Fukuoka""]",工学:工学,九州大学
D114081151,2014-08-28,2014-08-27:2014-10-20:NA,【公募】大学院保健学研究科看護学講座（看護管理学）教授の公募,教授相当,"[""群馬県""]","[""Gunma""]",医歯薬学,群馬大学
D114081153,2014-08-28,2014-08-27:2014-10-23:NA,【公募】大学院保健学研究科看護学講座（基礎看護学）教授の公募,教授相当,"[""群馬県""]","[""Gunma""]",医歯薬学:医歯薬学,群馬大学
D114081159,2014-08-28,2014-08-27:2014-10-20:NA,【公募】大学院保健学研究科看護学講座地域看護学分野（在宅GP）講師及び助教の公募,准教授・常勤専任講師相当:助教相当,"[""群馬県""]","[""Gunma""]",医歯薬学,群馬大学
D114081165,2014-08-28,2014-08-27:2014-10-17:NA,【公募】大学院保健学研究科看護学講座（応用看護学）教授の公募,教授相当,"[""群馬県""]","[""Gunma""]",医歯薬学,群馬大学
D114081127,2014-08-28,NA:2014-12-25:NA,鹿児島工業高等専門学校機械工学科（准教授・講師または助教）公募,准教授・常勤専任講師相当:助教相当,"[""鹿児島県""]","[""Kagoshima""]",工学,鹿児島工業高等専門学校
D114081138,2014-08-28,NA:2014-11-14:（左記終了日までに応募書類は必着のこと）,教授公募（集積量子デバイス工学分野）,教授相当,"[""大阪府""]","[""Osaka""]",工学:総合理工,大阪大学
D114070950,2014-08-28,NA:2014-11-21:当日消印有効,豊田工業大学工学部　准教授公募（表面科学および関連分野）,准教授・常勤専任講師相当,"[""愛知県""]","[""Aichi""]",工学:総合理工:工学,豊田工業大学
D114081100,2014-08-28,NA:2015-02-28:適任者が決定次第、応募を締め切ります。,大阪大学　ナノスピントロニクスグループ　特任助教の公募,助教相当,"[""大阪府""]","[""Osaka""]",数物系科学,大阪大学
D114081050,2014-08-28,NA:2015-03-31:採用者が決まり次第公募終了,尼崎研究開発センター　研究開発,研究開発・技術者相当,"[""兵庫県""]","[""Hyōgo""]",化学:化学,BASFジャパン株式会社
D114081139,2014-08-28,NA:2014-10-31:NA,山形大学理学部物質生命化学科　准教授の公募（生化学分野）,准教授・常勤専任講師相当,"[""山形県""]","[""Yamagata""]",化学:生物学,山形大学
D114081148,2014-08-28,NA:2014-11-28:随時募集　※但し、採用者が決定次第締め切ります。,テクニカルスタッフ募集（太陽光チーム）,研究・教育補助者相当,"[""福島県""]","[""Fukushima""]",化学:工学,独立行政法人産業技術総合研究所
D114081154,2014-08-28,NA:2014-11-28:随時募集　※但し、採用者が決定次第締め切ります。,テクニカルスタッフ募集(水素キャリアチーム)－エンジン実験補助、触媒実験補助、水電解実験等補助－,研究・教育補助者相当,"[""福島県""]","[""Fukushima""]",工学:化学:工学,独立行政法人産業技術総合研究所
D114081156,2014-08-28,NA:2014-11-28:随時募集　※但し、採用者が決定次第締め切ります。,産総研特別研究員募集（水素キャリアチーム：電気化学工学）,研究員・ポスドク相当,"[""福島県""]","[""Fukushima""]",化学:化学:工学,独立行政法人産業技術総合研究所
D114081162,2014-08-28,NA:2014-11-28:随時募集　※但し、採用者が決定次第締め切ります。,産総研特別研究員募集（水素キャリアチーム：燃焼工学）,研究員・ポスドク相当,"[""福島県""]","[""Fukushima""]",化学:工学:数物系科学,独立行政法人産業技術総合研究所
D114081158,2014-08-28,NA:2014-11-28:随時募集　※但し、採用者が決定次第締め切ります。,テクニカルスタッフ募集(福島再生可能エネルギー研究所)－プログラマ－,研究・教育補助者相当,"[""福島県""]","[""Fukushima""]",情報学,独立行政法人産業技術総合研究所
D114081150,2014-08-28,NA:2014-11-28:随時募集　※但し、採用者が決定次第、締め切ります。,テクニカルスタッフ募集(福島再生可能エネルギー研究所)－ネヂ強度試験等－,研究・教育補助者相当,"[""福島県""]","[""Fukushima""]",工学,独立行政法人産業技術総合研究所
D114080842,2014-08-27,NA:2014-10-31:JST,会津大学コンピュータ理工学部　テニュア・トラック教員公募,教授相当:准教授・常勤専任講師相当,"[""福島県""]","[""Fukushima""]",情報学:工学:数物系科学,会津大学
D114081087,2014-08-27,2014-08-26:2014-10-31:NA,准教授または講師の公募（国語科教育学）,准教授・常勤専任講師相当,"[""沖縄県""]","[""Okinawa""]",人文学:社会科学,琉球大学
D114081090,2014-08-27,2014-08-26:2014-10-31:NA,教授、准教授または講師の公募（英語教育）,教授相当:准教授・常勤専任講師相当,"[""沖縄県""]","[""Okinawa""]",人文学,琉球大学
D114081092,2014-08-27,2014-07-01:2014-10-31:8月22日締め切りを10月31日に延長しました。,大学教育開発センター担当教員(准教授または講師）の公募について（英語）,准教授・常勤専任講師相当,"[""香川県""]","[""Kagawa""]",人文学,香川大学
D114081052,2014-08-27,2014-08-25:2015-08-25:適任者が決定次第、応募を締め切ります。,講師および准教授の公募（病理診断科学）,准教授・常勤専任講師相当,"[""長崎県""]","[""Nagasaki""]",医歯薬学,長崎大学
D114080929,2014-08-27,NA:2014-10-20:随時,がん予防・検診研究センター保健政策研究部　特任研究補助員（非常勤職員）の募集について,研究・教育補助者相当,"[""東京都""]","[""Tokyo""]",化学:工学:生物学,独立行政法人国立がん研究センター
D114081063,2014-08-27,NA:2014-10-20:※ただし、応募者数が想定する人数に満たない場合は、募集期間を延長することがあります。,研究員もしくは技術研究員　【地球環境観測研究開発センター　北極域環境・気候研究グループ】,研究員・ポスドク相当,"[""神奈川県""]","[""Kanagawa""]",生物学:化学:数物系科学,独立行政法人海洋研究開発機構
D114081064,2014-08-27,NA:2014-10-20:※ただし、応募者数が想定する人数に満たない場合は、募集期間を延長することがあります。,研究員もしくは技術研究員　【地球環境観測研究開発センター　全球海洋化学・物理研究グループ】,研究員・ポスドク相当,"[""神奈川県""]","[""Kanagawa""]",化学:数物系科学:生物学,独立行政法人海洋研究開発機構
